"input text","origin case+#chunk","output text"
"Q: Did you say anything to him in that transfer about how much money there was there? A: Yes, I believe we heard the conversation yesterday. Q: Did you communicate with him in advance that it was going to be 277 titles?","United States v. Sherman, 2023 U.S. Dist. LEXIS 140980#61",""
"A: I don't remember, but it's possible, yes. Q: Well, why would you be using code words like ""titles""? A: I didn't use the word ""title,"" he used the word ""title."" Q: Why not just say 277,000 in cash?","United States v. Sherman, 2023 U.S. Dist. LEXIS 140980#62",""
"A: Because you don't say that over the phone. Q: Why? A: Because it's not -- the phones could be tapped, traced, whatever, so just don't talk like that on the phone.","United States v. Sherman, 2023 U.S. Dist. LEXIS 140980#63",""
"Q: And the worry that it might be tapped or traced is because police would be looking at illegal activity. Isn't that right? A: Sir, yes, I already agreed to that, the money could be from illegal activity, yes.","United States v. Sherman, 2023 U.S. Dist. LEXIS 140980#64",""
"Q: Would you agree that it would be likely from criminal activity? A: Most likely, yes. Q: And you know that most likely this money was criminal activity funds.","United States v. Sherman, 2023 U.S. Dist. LEXIS 140980#65",""
"Right? A: Yes, sir. (Id. at 105-07.) Sherman's own testimony establishes that he was objectively aware of the high probability that the funds were proceeds of criminal activity and deliberately avoided learning the true facts. Thus, the court finds that a reasonable juror could have found that Sherman was willfully blind about the likelihood that the money he transported was proceeds from unlawful activity as well as the covert nature of the transportation of the funds using couriers as a favor to his brother in Mexico.","United States v. Sherman, 2023 U.S. Dist. LEXIS 140980#66",""
"Reviewing the record in the light most favorable to the Government, as is required, the court concludes that any rational trier of fact could have found proof beyond a reasonable doubt on these three money laundering counts based on the available evidence. Therefore, Sherman's motion for judgment of acquittal on Counts 1, 3, and 5 will be denied. 2.","United States v. Sherman, 2023 U.S. Dist. LEXIS 140980#67",""
"Money Laundering to Avoid Reporting Requirements As to Counts 2, 4, and 6, the Government was required to prove: (1) the defendant attempted to transport or transfer a monetary instrument or funds; (2) the defendant's attempted transportation or transfer was from a place in the United States to or through a place outside the United States; (3) the defendant knew that the monetary instrument or funds involved in the transportation or transfer represented the proceeds of some form of unlawful activity; and (4) the defendant knew that the transportation or transfer of funds was designed in whole or in part to avoid a transaction reporting requirement under State or Federal law. 18 U.S.C. § 1956(a)(2)(B)(ii). On these counts, Sherman argues that no reasonable juror could have found that these elements were proved beyond a reasonable doubt for the following reasons: (1) the Government did not prove any source for the funds transferred or that Sherman was aware of an illegal source as raised in the preceding argument; (2) the Government did not provide any evidence that Sherman broke any law involving any state or federal reporting requirement, and the statute does not consider violations of Mexican requirements, if any; (3) the mere transfer of money between two people does not itself generate a reporting requirement; (4) at trial, the Government did not identify any specific reporting requirement violated by Sherman's actions; (5) there was no evidence from the IRS or any source that Sherman transferred the ""proceeds of unlawful activity"" through any United States or Mexican bank; (6) the Government did not produce evidence to prove Sherman knew that the purpose of handing the money to the informant was to avoid a reporting requirement; and (7) the Government did not establish that Sherman was required to put any of the money in a bank where it might be subject to regulation. (Doc.","United States v. Sherman, 2023 U.S. Dist. LEXIS 140980#68",""
"150, pp. 6-7.) In response, the Government argues that there was testimony that those who carry $10,000 or more in cash across the border are required to file a report, and deposits of $10,000 or more in cash into the banking system in the United States require similar reporting. (Doc. 153, p.","United States v. Sherman, 2023 U.S. Dist. LEXIS 140980#69",""
"23.) Additionally, the Government points to the testimony from law enforcement witnesses about the pervasiveness of smuggling cash into Mexico and their investigations and task forces focusing on such activities. (Id. at 24.) The Government highlights this testimony, as well as Ruben Martin's testimony about his involvement with DTOs in arguing that avoiding federal and state financial reporting requirements is a necessary part of the international drug trafficking business, and that a jury could infer that Sherman and his cohorts were trying to avoid such requirements. (Id.) Therefore, the Government contends that Sherman's motion for a new trial on these counts should be denied. Notwithstanding the arguments presented regarding the sufficiency of the evidence regarding the money laundering counts, the court ordered the parties to address the authority in United States v. Navarro, 145 F.3d 580 (3d Cir. 1998), as well as persuasive authority from other Circuit Courts, as to whether subsections (a)(2)(B)(i) and (a)(2)(B)(ii) of 18 U.S.C. § 1956 are separate offenses or separate means of committing a single offense. (Doc. 176, pp.","United States v. Sherman, 2023 U.S. Dist. LEXIS 140980#70",""
"2-3, n.2.) Because the court has determined that the convictions at Counts 1, 3, and 5 will not be vacated, this ""separate means"" issue is potentially dispositive with respect to Counts 2, 4, and 6. As a result, the court will address this issue before addressing the sufficiency of the evidence as to these counts. In Navarro, the defendants were charged in the conjunctive with promotion, concealment, and avoidance of reporting requirements in the context of 18 U.S.C. § 1956(a)(1)(B)(i) and (ii).","United States v. Sherman, 2023 U.S. Dist. LEXIS 140980#71",""
"145 F.3d at 582. The Third Circuit addressed defendants' argument on appeal that an unanimity instruction was necessary with respect to the alternative mental states defined in 18 U.S.C. § 1956 under the plain error standard of review. Id. at 585-92.","United States v. Sherman, 2023 U.S. Dist. LEXIS 140980#72",""
"The defendants argued that the alternative mental states in the statute constitute separate offenses, whereas the Government argued that they are separate means of committing a single offense. Id. at 585-86. The Navarro court concluded that ""the application of the Schad-Edmonds test to [18 U.S.C. § 1956] yields the conclusion that it is neither clear nor obvious that the three alternative mental states defined in § 1956 could not properly be treated as separate means of committing a single offense."" Id. at 592.","United States v. Sherman, 2023 U.S. Dist. LEXIS 140980#73",""
"The court noted that it found ""especially persuasive the reasoning in [United States v. Holmes, 44 F.3d 1150 (2d Cir. 1995),] that the point of the money laundering statute is to punish a financial transaction involving known illicit proceeds, accomplished for a guilty purpose. That multiple purposes could satisfy this end does not mean that Congress intended to create multiple offenses."" Id. However, the court noted that a footnote in an earlier decision cast some doubt on this conclusion, and thus left ""to another day (or to the en banc court) the task of definitive interpretation."" Id. After noting that Navarro can be differentiated from this case for at least two reasons, the Government observed that the reasoning in Navarro has been followed by two other Circuits, and other Circuits have reached the same conclusion without the depth of analysis provided in Navarro. (Doc. 180, p.","United States v. Sherman, 2023 U.S. Dist. LEXIS 140980#74",""
"15 (citing United States v. Seher, 562 F.3d 1344 (11th Cir. 2009); United States v. Booth, 309 F.3d 566 (9th Cir. 2002); United States v. Bolden, 325 F.3d 471 (4th Cir. 2003); United States v. Garcia-Torres, 341 F.3d 61 (1st Cir. 2003); and United States v. Holmes, 44 F.3d 1150 (2d Cir. 1995).) Sherman takes the position that the subsections are separate means of committing a single offense based on Navarro. (Doc. 181, p. 12.) Based on the exhaustive analysis set forth in Navarro, as well as the persuasive authority from five other Circuits, the court concludes that subsections (a)(2)(B)(i) and (a)(2)(B)(ii) of 18 U.S.C. § 1956 are separate means of committing a single offense.","United States v. Sherman, 2023 U.S. Dist. LEXIS 140980#75",""
"In light of this conclusion, the parties agree that the court should impose a single punishment on the pairs of offenses that each arise from a single transaction. (See Doc. 180, p. 15 (citing Ball v. United States, 470 U.S. 856, 105 S. Ct. 1668, 84 L. Ed.","United States v. Sherman, 2023 U.S. Dist. LEXIS 140980#76",""
"2d 740 (1985); Doc. 181, p. 12.) Accordingly, the court will vacate Sherman's convictions for Counts 2, 4, and 6.","United States v. Sherman, 2023 U.S. Dist. LEXIS 140980#77",""
"3. Drug Trafficking Conspiracy Sherman argues that the evidence at trial was insufficient to prove him guilty of a drug trafficking conspiracy. (Doc. 150, pp.","United States v. Sherman, 2023 U.S. Dist. LEXIS 140980#78",""
"7-10.) Sherman focuses his argument on the lack of direct evidence that Sherman conspired specifically with any particular Mexican drug trafficking organization, cartel, or Paul Alston. (Id.) Relatedly, Sherman argues that the Government's evidence showed three separate categories of activities—selling drugs to Alston, picking up drugs in California, and delivering large amounts of cash to confidential human sources—but did not prove a link between these categories. (Id.) Finally, Sherman asserts that certain discrete facts were not proven beyond a reasonable doubt at trial. (Id. at 8-9.) The Government counters by asserting that Sherman's argument is a ""divide and conquer"" strategy that focuses on isolated facts and challenges the inferences that could or could not be drawn from such facts, but ignores the totality of the evidence. (Doc. 153, pp. 26-29.) The Government argues that when the trial evidence is viewed in totality, the evidence was sufficient to conclude that Sherman was clearly involved in a drug trafficking conspiracy. (Id. at 28-29.) To prove a conspiracy, the Government was required to show: (1) a shared unity of purpose; (2) an intent to achieve a common illegal goal; and (3) an agreement to work toward that goal.","United States v. Sherman, 2023 U.S. Dist. LEXIS 140980#79",""
"United States v. Caraballo-Rodriguez, 726 F.3d 418, 425 (3d Cir. 2013) (citing United States v. Boria, 592 F.3d 476, 481 (3d Cir. 2010)). The Government may prove these elements with either direct or circumstantial evidence. Id. (citing United States v. Brodie, 403 F.3d 123, 134 (3d Cir. 2005)).","United States v. Sherman, 2023 U.S. Dist. LEXIS 140980#80",""
"Although it is true that the Government did not necessarily ""connect the dots"" between the categories of activities referenced by Sherman, that was not necessary given how the drug trafficking conspiracy was charged and the Government's presentation of evidence on this charge. Specifically, Count 7 of the second superseding indictment charged Sherman with conspiracy to distribute and possess with intent to distribute 500 grams and more of cocaine between ""on or about 2012 to in or about May 2018"" in the Middle District of Pennsylvania, the Eastern District of Pennsylvania, the Middle District of California, the Southern District of California, and elsewhere, in violation of 21 U.S.C. § 846. (Doc. 116, p.","United States v. Sherman, 2023 U.S. Dist. LEXIS 140980#81",""
"7.) Sherman was accused of participating in a drug trafficking conspiracy with ""other persons known and unknown to the Grand Jury"" and he was the sole defendant named in the second superseding indictment. (Id.) There is no reference in Count 7 of the second superseding indictment to Paul Alston, a Mexican drug trafficking organization, or a cartel. In the brief in opposition to Sherman's post-trial motion, the Government summarized its presentation of evidence on this count as follows: Sherman was clearly involved in a drug conspiracy, which may have had different participants enter and leave over time, i.e. Paul Alston. It clearly continued over years and involved Sherman trafficking drugs acquired from sources in Mexico.","United States v. Sherman, 2023 U.S. Dist. LEXIS 140980#82",""
"The exact contours of the conspiracy, the specific participants at any given time, and the participants['] roles at any given time are not facts necessary for a jury to conclude guilt. What is necessary for conviction is sufficient proof that Sherman entered into an agreement with someone else to traffic drugs. There was more than sufficient evidence to conclude that he did.","United States v. Sherman, 2023 U.S. Dist. LEXIS 140980#83",""
"Indeed his own testimony established that he did. (Doc. 153, pp. 28-29.) This is consistent with the overview provided by the Government in closing argument: What we have here with Mr.","United States v. Sherman, 2023 U.S. Dist. LEXIS 140980#84",""
"Sherman is a large cocaine trafficker from Lancaster, Pennsylvania . . . . Almost by the necessity of the size and scope of what he was up to requires working with other people and requires working with other people to have customers, to have places to hide your stuff, places to conceal your stuff, to pick up the drugs, to have the drugs imported and shipped to you, to have cash, to have whatever instruments you need to protect your operation. It necessarily involves other people.","United States v. Sherman, 2023 U.S. Dist. LEXIS 140980#85",""
"And in the course of this investigation, the government found insights into this world and insights into this life and this operation of the defendant and in furtherance of his drug trafficking conspiracy. That's what an operation is, a group of people working together. He was delivering cash, he was picking up kilos, he was using lidocaine powder for cutting agents, he was crossing the border into Mexico, he was getting traps put in his cars in furtherance of all of it.","United States v. Sherman, 2023 U.S. Dist. LEXIS 140980#86",""
"This was his operation with others. Very straightforward. (Doc. 167, p.","United States v. Sherman, 2023 U.S. Dist. LEXIS 140980#87",""
"12.) The Government did not attempt to ""connect the dots"" to prove exactly who Sherman conspired with throughout the conspiracy, instead relying on the evidence proving that he conspired with ""other people"" generally to sell drugs. (See, e.g., id. at 29, 60-61.) After reviewing the record in the light most favorable to the Government, the court concludes that, based on the totality of the evidence presented at trial, any rational trier of fact could have found proof of guilt beyond a reasonable doubt based on the evidence that Sherman was involved in a drug trafficking conspiracy with other people who shared a unity of purpose to traffic cocaine, an intent to achieve that common illegal goal, and an agreement to work toward that goal as demonstrated by their conduct. Therefore, Sherman's motion for judgment of acquittal on Count 7 will be denied. 4.","United States v. Sherman, 2023 U.S. Dist. LEXIS 140980#88",""
"Money Laundering Conspiracy Sherman argues that the evidence at trial was insufficient to prove him guilty of a money laundering conspiracy. (Doc. 150, pp. 10-14.) Sherman incorporates his arguments regarding the insufficiency of the evidence with respect to the individual money laundering counts, and once again asserts that no reasonable juror could infer that Sherman conspired to launder money with the Beltran drug trafficking organization. (Id.) Sherman also details instances in which the Government did not prove Sherman's knowledge of specific events, inconsistent evidence, or evidence that does not tend to prove that a money laundering conspiracy existed or that Sherman participated in it. (Id.) Finally, Sherman argues that the Government failed to prove that a conspiracy existed ""between Dwayne Sherman and anyone but the informant and the person who gave him the money"" and also failed to prove that the conspiracy was still ongoing after January 15, 2016. (Id. at 14.) The Government responded by incorporating their argument regarding the sufficiency of the evidence on the substantive money laundering counts, and asserting that the challenge to the money laundering conspiracy conviction is without merit. (Doc.","United States v. Sherman, 2023 U.S. Dist. LEXIS 140980#89",""
"153, p. 29.) The elements of a money laundering conspiracy, pursuant to 18 U.S.C. § 1956(h), are: ""(1) that an agreement was formed between two or more persons [to commit the offense of money laundering]; and (2) that the defendant knowingly became a member of the conspiracy."" United States v. Greenidge, 495 F.3d 85, 100 (3d Cir. 2007). The court will not repeat the analysis set forth above regarding the substantive money laundering counts.","United States v. Sherman, 2023 U.S. Dist. LEXIS 140980#90",""
"However, the court notes that the above discussion regarding the substantive counts largely resolves Sherman's argument regarding the money laundering conspiracy. In addition, the court notes that Count 8 of the second superseding indictment accuses Sherman of conspiring with ""other persons known and unknown to the Grand Jury"" to commit the offense of money laundering between on or about October 2015 to in or about May 2018, in the Middle District of Pennsylvania, the Eastern District of Pennsylvania, the Southern District of California, and elsewhere. (Doc. 116, p.","United States v. Sherman, 2023 U.S. Dist. LEXIS 140980#91",""
"8.) The Government neither charged nor attempted to prove that Sherman conspired with the Beltran DTO or any other specific person to launder money. Instead, the Government alleged and presented evidence at trial to establish that Sherman conspired with others (not limited to Government agents or informants) to launder money in order to conceal drug trafficking proceeds. After reviewing the record in the light most favorable to the Government, the court concludes that, based on the totality of the evidence presented at trial, any rational trier of fact could have found proof of guilt beyond a reasonable doubt based on the evidence that Sherman was involved in a money laundering conspiracy.","United States v. Sherman, 2023 U.S. Dist. LEXIS 140980#92",""
"Therefore, Sherman's motion for judgment of acquittal on Count 8 will be denied. C. Weight of Evidence Sherman argues that the court should consider his arguments regarding insufficient evidence and order a new trial in the interest of justice pursuant to Federal Rule of Criminal Procedure 33(a). (Doc. 150, pp.","United States v. Sherman, 2023 U.S. Dist. LEXIS 140980#93",""
"14-16.) The Government did not respond to this argument. Sherman largely references the arguments the court has already rejected in support of his request for a new trial. The only new argument raised is that Paul Alston was not a credible witness. (Id. at 15-16.) The court does not agree.","United States v. Sherman, 2023 U.S. Dist. LEXIS 140980#94",""
"A key indicator that Paul Alston testified truthfully with respect to Sherman being a source of large quantities of cocaine was his testimony that Sherman told him in 2014 that he found a tracking device on his vehicle. (Doc. 155, p. 24.) This fact was confirmed by Sherman through his counsel's questioning of Paul Alston. (Id.) It is difficult to imagine how Paul Alston could have known this fact unless he was, in fact, purchasing drugs from Sherman in 2014 when Sherman decided to stop his activities due to finding the tracking device.","United States v. Sherman, 2023 U.S. Dist. LEXIS 140980#95",""
"In any event, the court can order a new trial ""only if it believes that there is a serious danger that a miscarriage of justice has occurred—that is, that an innocent person has been convicted."" Silveus, 542 F.3d at 1004-05. Having reviewed Sherman's arguments and the trial record, the court does not believe that the jury's verdict is a miscarriage of justice. As a result, Sherman's motion for a new trial pursuant to Federal Rule of Criminal Procedure 33(a) will be denied.","United States v. Sherman, 2023 U.S. Dist. LEXIS 140980#96",""
"D. Objections at Trial Sherman continues his objections raised at trial, including venue entrapment and objections relating to jury instructions. 1. Venue Entrapment Following the close of the Government's case-in-chief, counsel for Sherman moved for judgment of acquittal pursuant to Federal Rule of Criminal Procedure 29. (Doc.","United States v. Sherman, 2023 U.S. Dist. LEXIS 140980#97",""
"165, pp. 270-272.) At the close of his argument, counsel raised an issue of venue entrapment, arguing that the agents and confidential human sources brought Sherman into the Middle District of Pennsylvania when he was not otherwise planning to travel into the district. (Id. at 272.) In response, the Government argued that the defense had not presented legal authority as to what would constitute venue entrapment. (Id. at 276.) Because no legal authority had been presented on venue entrapment and because the testimony established that the informants proposed a meeting location in Harrisburg that Sherman agreed to, the court denied Sherman's motion for judgment of acquittal on this basis. (Id. at 277.) In the instant motion, Sherman once again raises the issue of venue entrapment. Sherman argues that the evidence at trial showed that the informant lured Sherman into the Middle District of Pennsylvania for the cash transfer even though the other criminal activity alleged against him occurred in Lancaster in the Eastern District of Pennsylvania. (Doc.","United States v. Sherman, 2023 U.S. Dist. LEXIS 140980#98",""
"150, pp. 16-17.) Sherman also asserts that there is no evidence of any drug trafficking in the Middle District of Pennsylvania at all. (Id. at 17.) In response, the Government notes that there is a specific venue statute for money laundering, examination of which confirms that venue lies in this district because the cash transactions took place in this district. (Doc. 153, p.","United States v. Sherman, 2023 U.S. Dist. LEXIS 140980#99",""
"30.) Additionally, the Government argues that the Third Circuit has not recognized a venue entrapment claim, and other circuits that have considered venue entrapment have rejected it. (Id. at 30-31.) In his reply brief, Sherman asserts that the Government cannot make a credible or legitimate argument that Sherman was not lured to the Middle District of Pennsylvania by the confidential human sources. (Doc. 156, p. 11.) Additionally, Sherman repeats that all of his activities were in Lancaster and that there is no evidence he ever did anything in Harrisburg. (Id.) Sherman contends that there was no reason for him to be in the Middle District of Pennsylvania except for the confidential human source saying that he wanted the money to be delivered to Harrisburg, and that such purposeful venue misconduct should not be rewarded. (Id. at 11-12.) However, once again, Sherman has not provided any authority to support his position that he is entitled to a judgment of acquittal on this basis.","United States v. Sherman, 2023 U.S. Dist. LEXIS 140980#100",""
"Sherman has provided no binding or even persuasive authority supporting the notion that venue entrapment is a basis for granting judgment of acquittal. Therefore, the court need not make a determination as to whether or not Sherman was in fact ""lured"" to the Middle District of Pennsylvania by law enforcement authorities and the confidential human sources. Sherman's motion for judgment of acquittal on the basis of venue entrapment will be denied.","United States v. Sherman, 2023 U.S. Dist. LEXIS 140980#101",""
"2. Bulk Cash Smuggling Jury Instruction Sherman also continues his objection to the court's refusal to give the requested bulk cash smuggling jury charge. (Doc. 150.) The Government argues that for the reasons identified by the court at trial, the jury was properly instructed. (Doc.","United States v. Sherman, 2023 U.S. Dist. LEXIS 140980#102",""
"153, p. 32.) During the trial, counsel for Sherman stated in his opening statement that Sherman was charged with money laundering, which was different from ""handing over cash"" and that the jury would be permitted to consider a separate charge of transferring bulk cash. (Doc. 163, pp.","United States v. Sherman, 2023 U.S. Dist. LEXIS 140980#103",""
"47-48.) On the second day of trial, while court was in recess, the Government indicated that it was looking into whether bulk cash smuggling was a lesser included offense of any of the charged offenses. (Doc. 164, p. 8.) On the third day of trial, prior to the commencement of proceedings, Sherman submitted a proposed jury instruction for bulk cash smuggling. (Doc.","United States v. Sherman, 2023 U.S. Dist. LEXIS 140980#104",""
