"input text","origin case+#chunk","output text"
"First, it argues that the district court's statement was in reference to Klensch's ""unique culpability, not his indispensability."" The Government makes compelling points that human smugglers are more culpable than drug smugglers because they make choices that impact ""life and death,"" such as whether to conceal the passengers, gain compliance from potentially unruly passengers, bring water or other necessities for the passengers, and so forth. But the problem is none of this reasoning was articulated by the district court. See Emmett, 749 F.3d at 821-22 (remanding where ""the single explanation in the record"" did not ""explain why"" the defendant's ""request should be denied under the applicable legal standard"").","United States v. Klensch, 87 F.4th 1159#27",""
"And it is just as plausible, based on what the district court did say, that it concluded Klensch did not play a minor role because transporting the two men who entered the U.S. illegally away from the border was too integral to be minor conduct. Second, the Government argues that the district court rejected Klensch's untruthful account about his level of involvement, as evidenced by the district court's statement that it did not think there was ""sufficient evidence that [Klensch's] role was minor."" As an initial matter, the Government did not dispute the veracity of the facts recited in the PSR.2 We treat facts as undisputed when ""they are drawn solely from a Presentence Report whose accuracy neither party challenged."" Gasca-Ruiz, 852 F.3d at 1168. We therefore reject the Government's argument to the extent it advances a new factual dispute.","United States v. Klensch, 87 F.4th 1159#28",""
"To the extent the Government is arguing that Klensch failed to meet his burden of showing that he performed a minor role in the criminal activity, it is true that HN7[] the district court can refuse to grant a minor-role reduction if it finds that the evidence failed to show that there were co-participants or that the defendant's role was minor in comparison to his co-participants. See Diaz, 884 F.3d at 914 (explaining that the defendant bears the burden of proof); see also Dominguez-Caicedo, 40 F.4th at 960 (explaining that a district court must first identify individuals for whom there is sufficient evidence of their existence and participation in the scheme). But, again, the district court's cursory explanation does not make clear that either of these rationales were the basis for its decision to deny a minor-role reduction.","United States v. Klensch, 87 F.4th 1159#29",""
"While we generally assume that the district court applied the correct legal standard, we cannot do so when the record indicates the contrary. See Diaz, 884 F.3d at 917-18. Because we conclude that the district court did not apply the correct legal standard in denying a minor-role reduction, we must determine the proper course for remedying this error.","United States v. Klensch, 87 F.4th 1159#30",""
"HN8[] Errors that impact Guideline calculations typically require remand unless the Government establishes the error was harmless. See Dominguez-Caicedo, 40 F.4th at 963; see also United States v. Bankston, 901 F.3d 1100, 1108 (9th Cir. 2018) (""[Where] we cannot say with certainty that the district court's sentencing error was harmless, we must remand for resentencing.""). The Government has not argued harmless error here.","United States v. Klensch, 87 F.4th 1159#31",""
"Therefore, we vacate Klensch's sentence and remand for resentencing with instruction that the district court reassess the minor-role reduction consistent with U.S.S.G. § 3B1.2 cmt. n.3(C) and this opinion.3 B. Dangerous-Weapon Enhancement Klensch also argues that the district court erred by imposing a dangerous-weapons enhancement because he did not possess the stun gun in his car in connection with his illegal smuggling activity. HN9[] ""[W]e review the district court's identification of the correct legal standard de novo . . . the district court's factual findings for clear error,"" and the ""district court's application of the Sentencing Guidelines to the facts of a given case . . . for abuse of discretion."" Gasca-Ruiz, 852 F.3d at 1170 (9th Cir. 2017). HN10[] Under U.S.S.G. § 2L1.1(b)(5)(C), a sentence for transporting an illegal alien is increased to the greater of two levels or an overall increase to offense level 18 ""[i]f a dangerous weapon (including a firearm) was possessed.""4 Klensch does not dispute that he possessed a stun gun during his offense or that a stun gun qualifies as a dangerous weapon under the Guideline.","United States v. Klensch, 87 F.4th 1159#32",""
"Klensch argues only that the district court had to find a nexus between his possession of the stun gun and ""the criminal act"" and that it erred in applying a some-evidence standard in making this finding, rather than a clear-and-convincing-evidence standard. HN11[] The plain text of § 2L1.1(b)(5)(C) does not require a nexus between possession of a weapon and commission of the crime. But § 1B1.3 addresses enhancements based on ""specific offense characteristics""—such as § 2L1.1(b)(5)(C)—and requires courts to consider acts ""that occurred during the commission of the offense of conviction."" U.S.S.G. § 1B1.3(a)(1).","United States v. Klensch, 87 F.4th 1159#33",""
"Thus, read together, § 1B1.3 and § 2L1.1(b) require at least that the court find that the defendant possessed a dangerous weapon during the commission of the offense. Klensch relies on cases interpreting § 2D1.1 (a provision addressing weapons possession in connection with certain drug-related offenses) to argue that a nexus between his possession of the stun gun and his crime must be proven by clear and convincing evidence. Section 2D1.1 has a similar dangerous-weapon enhancement as § 2L1.1, but the commentary to the § 2D1.1 enhancement states that it should not be applied if ""it is clearly improbable that the weapon was connected with the offense."" Id. § 2D1.1 cmt. n.11(A).","United States v. Klensch, 87 F.4th 1159#34",""
"The commentary to § 2L1.1 contains no such language, and the Government argues that as a matter of plain text no nexus is required under § 2L1.1. We need not resolve today whether a nexus standard like that in § 2D1.1 is required under § 2L1.1(b)(5)(C), because even assuming that it is, the district court could still have applied the dangerous-weapon enhancement. HN12[] The enhancement for possession of a weapon under § 2D1.1 applies where ""the weapon was present, unless it is clearly improbable that the weapon was connected with the offense."" United States v. Gomez, 6 F.4th 992, 1008 (9th Cir. 2021) (internal quotation marks and citation omitted).","United States v. Klensch, 87 F.4th 1159#35",""
"The government need only prove ""that the weapon was possessed at the time of the offense."" United States v. Alaniz, 69 F.4th 1124, 1126-27 (9th Cir. 2023). And if it meets this burden, the enhancement ""applies unless the defendant shows it was 'clearly improbable' that the weapon was possessed in connection with the offense."" Id. at 1127 (citation omitted) (emphasis added). Klensch does not dispute that he had the stun gun in his car when he transported the two men.","United States v. Klensch, 87 F.4th 1159#36",""
"By extension he does not dispute that the Government met its initial burden. Thus, under the § 2D1.1 standard, the burden would fall on Klensch to prove by clear and convincing evidence that it was ""improbable that the weapon was connected to the offense."" Id. at 1126. This he cannot do.","United States v. Klensch, 87 F.4th 1159#37",""
"Klensch acknowledged the stun gun was within his reach when he was transporting the two men, and he told the district court at his sentencing hearing that he had the stun gun ""for . . . my own protection, just if I need to deter anybody away from me."" Even if Klensch was concerned about protecting himself from risks related to homelessness, that does not prevent the stun gun from also serving to protect him in the course of his criminal activity. Klensch agreed to pick up strangers at an unfamiliar location and drive them in his car (which apparently contained most of his possessions). It is understandable for someone in this situation to want some means of self-protection.","United States v. Klensch, 87 F.4th 1159#38",""
"And it was not an abuse of discretion for the district court to conclude that the stun gun located within Klensch's reach in his car had a nexus to his criminal conduct that occurred in the car. We therefore conclude that even if the district court applied an incorrect standard of proof by not requiring the Government to prove a nexus to the stun gun, such error was harmless because the district court ""would have imposed the same sentence"" even if it had required the Government to make this showing. Williams v. United States, 503 U.S. 193, 203, 112 S. Ct. 1112, 117 L. Ed.","United States v. Klensch, 87 F.4th 1159#39",""
"2d 341 (1992); see also United States v. Halamek, 5 F.4th 1081, 1091 (9th Cir. 2021) (applying Williams's harmless-error standard). We affirm the district court's imposition of the dangerous-weapons enhancement under § 2L1.1(b). CONCLUSION We affirm the district court's application of the six-level dangerous-weapons enhancement.","United States v. Klensch, 87 F.4th 1159#40",""
"However, because the district court erred in its analysis of the two-level minor-role reduction, we vacate Klensch's sentence and remand for resentencing. At resentencing, the district court is directed to determine whether Klensch played a minor role in the 18 USA V. KLENSCH transportation of illegal aliens consistent with the factors listed in U.S.S.G. § 3B1.2 cmt. n.3(C) and this opinion. AFFIRMED in part, VACATED, and REMANDED.","United States v. Klensch, 87 F.4th 1159#41",""
