"input text","origin case+#chunk","output text"
"139.) During the charge conference, counsel for Sherman asserted that bulk cash transfer, 31 U.S.C. § 5332(a)(1), is a lesser included offense of money laundering and requested that the bulk cash transfer jury instruction be included. (Doc. 165, p. 292.) The court identified the threshold inquiry as whether bulk cash transfer is a lesser included offense of either of the money laundering violations charged in the indictment. (Id. at 293.) Relying on Supreme Court case law provided by counsel, the court found the required elements of the bulk cash smuggling criminal provision in § 5332 to be a defendant who knowingly conceals more than $10,000 in currency, which could be lawful proceeds because there is no requirement that the proceeds be unlawful, could be found guilty of that offense. (Id. at 299.) The court noted that the first element for bulk cash smuggling also included a requirement that the amount exceed $10,000 in currency, and the cash must be on the person of such individual, or in any conveyance, article of luggage, merchandise, or other container. (Id.) The court concluded that those elements are different than the elements of the money laundering statute. (Id.) Furthermore, the court identified a different intent requirement between the two statutes, as the bulk cash smuggling statute requires specific intent whereas the money laundering statute contains a knowing element. (Id. at 299-300.) While not making a final determination at the charge conference, the court also noted that the Supreme Court examined the two statutes and determined that they targeted distinct conduct. (Id. at 301.) The following morning, before the jury entered the courtroom and trial commenced, the court heard additional argument from both parties and ultimately concluded that under the test set forth in Schmuck v. United States, 489 U.S. 705, 109 S. Ct. 1443, 103 L. Ed.","United States v. Sherman, 2023 U.S. Dist. LEXIS 140980#105",""
"2d 734 (1989), because the bulk cash smuggling statute, § 5332(a)(1), requires an element not required for the greater offense, which is the money laundering statute, § 1956(a)(2)(B)(i) or (ii), it was not a lesser-included offense. (Doc. 166, pp. 7-11.) The Supreme Court has set forth the test for when an offense is a lesser-included offense: ""one offense is not necessarily included in another unless the elements of the lesser offense are a subset of the elements of the charged offense."" Schmuck, 489 U.S. at 716.","United States v. Sherman, 2023 U.S. Dist. LEXIS 140980#106",""
"Furthermore, the Court stated that ""[w]here the lesser offense requires an element not required for the greater offense, no instruction is to be given under [Federal Rule of Criminal Procedure] Rule 31(c)."" Id. The Supreme Court has specifically compared the bulk cash smuggling statute and the money laundering statute. See Regalado Cuellar v. United States, 553 U.S. 550, 128 S. Ct. 1994, 170 L. Ed. 2d 942 (2008).","United States v. Sherman, 2023 U.S. Dist. LEXIS 140980#107",""
"In undertaking this comparison, the court observed: To be sure, certain conduct may fall within both statutes. For example, both provisions may be violated by a defendant who intends to evade a relevant reporting requirement. See [31 U.S.C. 5332(a)(1)] (transportation of funds ""with the intent to evade a currency reporting requirement""); 18 U.S.C. § 1956(a)(2)(B)(ii) (transportation of funds knowing that it is designed ""to avoid a transaction reporting requirement"").","United States v. Sherman, 2023 U.S. Dist. LEXIS 140980#108",""
"But only the money laundering statute may be violated in the absence of such intent. See § 1956(a)(2)(B)(i) (prohibiting transportation of illicit funds knowing that the transportation is designed to conceal or disguise a listed attribute). Similarly, although both statutes encompass transportation of illicit funds, only the bulk cash smuggling statute also punishes the mere transportation of lawfully derived proceeds.","United States v. Sherman, 2023 U.S. Dist. LEXIS 140980#109",""
"Compare 31 U.S.C. § 5332(a) (omitting any requirement that the funds be unlawfully derived) with 18 U.S.C. § 1956(a)(2)(B) (requiring that the defendant ""kno[w] that the monetary instrument or funds involved in the transportation . . . represent the proceeds of some form of unlawful activity""). Id. at 560-61. However, this observation was provided after the Court unequivocally concluded that despite some overlap between the statutes, ""the two statutes nonetheless target distinct conduct."" Id. at 560.","United States v. Sherman, 2023 U.S. Dist. LEXIS 140980#110",""
"Although the question before the Supreme Court in Cuellar was not whether bulk cash smuggling was a lesser-included offense of money laundering, the Court concluded that the statutes target distinct conduct and analyzed elements in the bulk cash smuggling statute that are not elements of money laundering. Therefore, consistent with this court's prior ruling during trial, the court now concludes that bulk cash smuggling is not a lesser-included offense of money laundering and the inclusion of the instruction was not permitted under Federal Rule of Criminal Procedure 31(c). This aspect of Sherman's motion will be denied.","United States v. Sherman, 2023 U.S. Dist. LEXIS 140980#111",""
"3. Sears Charge Prior to the last day of the trial, counsel for Sherman submitted a proposed jury instruction requesting a Sears 3 instruction be given. (Doc. 143.) On the morning of the last day of the trial, the court discussed the additional instruction with counsel. (Doc.","United States v. Sherman, 2023 U.S. Dist. LEXIS 140980#112",""
"167, pp. 3-6.) While the Government did not oppose the instruction, the court indicated that the evidence presented at trial did not warrant giving the instruction to the jury. (Id. at 3.) Specifically, the court pointed to Sherman's own testimony that there were individuals aside from the confidential human sources who were involved in the conduct at issue, and therefore concluded that the instruction was not supported by the record and was not warranted. (Id. at 6.) In the instant motion, Sherman continues his objection to the court's refusal to give the requested Sears charge to the jury. (Doc. 150, p.","United States v. Sherman, 2023 U.S. Dist. LEXIS 140980#113",""
"17.) The Government again argues that for the reasons identified by the court at trial, the jury was properly instructed. (Doc. 153, p. 32.) Sherman has presented no new arguments and has pointed to no evidence in the record that would change the court's original analysis.","United States v. Sherman, 2023 U.S. Dist. LEXIS 140980#114",""
"As to the cash transfers, in addition to getting a phone call from his brother to initiate the cash transfers, Sherman testified that he got the money from an individual named Rico. There was no testimony that Sherman's brother or Rico were government agents or informants. Additionally, there was no evidence that the subsequent couriers were government agents.","United States v. Sherman, 2023 U.S. Dist. LEXIS 140980#115",""
"As to prior drug trafficking activity, Paul Alston testified that Sherman sold him cocaine for several years. Although Alston began cooperating with the United States in 2018, there was no testimony that he was a government agent or informant during the time when he purchased cocaine from Sherman in 2013 and 2014. Finally, as to the purchase of controlled substances in California, Sherman testified that Sam Pena and at least one other unnamed individual were involved.","United States v. Sherman, 2023 U.S. Dist. LEXIS 140980#116",""
"Therefore, the court's analysis remains unchanged -- the evidence of record did not support giving the instruction to the jury, as it was clear that there were alleged co-conspirators involved who were not government agents or informants. This aspect of Sherman's motion will likewise be denied. Conclusion Because the court concludes that sufficient evidence supports the jury's verdict and that the verdict was not against the weight of the evidence, the court will deny Sherman's post-trial motion.","United States v. Sherman, 2023 U.S. Dist. LEXIS 140980#117",""
"However, because the court concludes that the pairs of substantive money laundering counts constitute separate means of committing a single offense, the court will vacate Sherman's convictions at Counts 2, 4, and 6. A separate order will follow. /s/ Jennifer P. Wilson JENNIFER P. WILSON United States District Judge Middle District of Pennsylvania Dated: August 11, 2023 ORDER AND NOW, on this 11th day of August, 2023, for the reasons set forth in the accompanying memorandum, IT IS ORDERED THAT: 1. Defendant's post-trial motion, Doc.","United States v. Sherman, 2023 U.S. Dist. LEXIS 140980#118",""
"149, is DENIED. 2. However, because the court concludes that the pairs of substantive money laundering counts constitute separate means of committing a single offense, the court VACATES Defendant's convictions at Counts 2, 4, and 6. /s/ Jennifer P. Wilson JENNIFER P. WILSON United States District Judge Middle District of Pennsylvania End of Document","United States v. Sherman, 2023 U.S. Dist. LEXIS 140980#119",""
"FORREST, Circuit Judge: Defendant-Appellant William Klensch appeals his sentence after pleading guilty to one count of transportation of an illegal alien. Over Klensch's objection, the district court followed the presentence report's (PSR) recommendations to not grant a minor-role reduction under U.S.S.G. § 3B1.2 and to impose a six-level dangerous-weapon enhancement under § 2L1.1(b)(5)(C) because Klensch possessed a stun gun during his offense. We have jurisdiction under 28 U.S.C. § 1291, and we affirm as to the dangerous-weapon enhancement and vacate and remand for resentencing for the district court to conduct a proper minor-role analysis.","United States v. Klensch, 87 F.4th 1159#1",""
"I. BACKGROUND In May 2022, a home inspector with whom Klensch had worked offered him $500.00 to pick up an unspecified number of ""workers"" at a grocery store near the border in Jacumba, California and transport them to Spring Valley, California. Klensch drove to the designated location and picked up two men. That same day, a United States Border Patrol agent working in the area was notified to watch for a rental car matching the general description of Klensch's vehicle that had raised law enforcement's suspicion.","United States v. Klensch, 87 F.4th 1159#2",""
"The agent observed Klensch's vehicle drive behind a local store, reappear a few minutes later, pull onto the highway, and drive away at a high rate of speed. Another agent was contacted and pulled over Klensch's vehicle. Klensch consented to the agent opening the rear door of his car, and the agent discovered two men trying to hide in the back seat.","United States v. Klensch, 87 F.4th 1159#3",""
"Border Patrol determined that the two men were Mexican citizens without authorization to be in the United States, and all the occupants in the car were arrested and transported to a Border Patrol station. Agents discovered that Klensch had an extensive criminal history. They also found a stun gun and several packages of personal-use drugs in Klensch's driver-side door compartment.","United States v. Klensch, 87 F.4th 1159#4",""
"Klensch later explained that most of his personal property was in his car because he was homeless and preparing to move to Washington. The two male passengers confirmed that they were Mexican citizens without authorization to be in the United States. One of them disclosed that he paid $8,500 to be illegally smuggled into the United States.","United States v. Klensch, 87 F.4th 1159#5",""
"He also explained that someone directed him by phone to an initial location, where he hid until he received instructions to go to the location where Klensch picked him up. The Government charged Klensch with two counts of illegal transportation of an alien under 8 U.S.C. § 1324(a)(1)(A)(ii). Klensch pleaded guilty to one count under a plea agreement, and he agreed to request a PSR.","United States v. Klensch, 87 F.4th 1159#6",""
"The PSR calculated an offense level of 15 and a category VI criminal history, resulting in a Guideline range of 33-41 months' imprisonment. The PSR recommended against applying a two-level minor-role reduction because the evidence was insufficient ""to support that [Klensch] was substantially less culpable than other participants to support a reduction under USSG § 3B1.2."" And in its offense-level calculation, the PSR applied a six-level dangerous-weapon enhancement under U.S.S.G. § 2L1.1(b)(5)(C) for possession of the stun gun during the offense. The PSR recommended 37 months' imprisonment and three years' supervised release.","United States v. Klensch, 87 F.4th 1159#7",""
"Klensch objected in writing to the PSR. He argued that he was entitled to a minor-role reduction because the factors governing this analysis weighed in his favor and he was ""substantially less culpable than the average participant in the criminal activity of migrant smuggling."" He also argued that the dangerous-weapon enhancement was improper because the Government had not proven by clear and convincing evidence that he possessed the stun gun in relation to the crime charged. Klensch calculated his Guideline range as 6-12 months' imprisonment based on, among other things, a base offense level of 12, a two-level minor-role reduction, and no dangerous-weapon enhancement.","United States v. Klensch, 87 F.4th 1159#8",""
"He argued for a 13-month custody sentence with no supervision because of ""the things in his car."" The Government calculated a 18-24 months Guideline range and requested a 21-month sentence. At the sentencing hearing, Klensch argued both the minor-role reduction and dangerous-weapons enhancement. The district court did not inquire about the minor-role reduction, but it did ask Klensch why he had the stun gun.","United States v. Klensch, 87 F.4th 1159#9",""
"Klensch responded that he had it for ""protection"" in case he needed ""to deter anybody away from"" him. Klensch's counsel interjected and explained that Klensch was homeless and in the process of moving to Washington to be with family, and thus had all his personal property with him in his car. After hearing the parties' arguments, the district court issued its decision from the bench, following the recommendations in the PSR.","United States v. Klensch, 87 F.4th 1159#10",""
"In cursory terms, the district court stated that it declined to apply a minor-role reduction because ""Klensch was the one transporting the individuals"" and the evidence did not show ""his role was minor."" And the district imposed the dangerous-weapon enhancement because ""[Klensch] was engaged in a dangerous venture,"" and there was ""evidence that [the stun gun] was related to the offense. It was possessed right where he could grab it, in case he needed it against the individuals who were in the car with him or anyone who challenged him while he was committing this offense."" Based on its findings, the district court calculated a Guideline range of 33-41 months, and it sentenced Klensch to a low-end 33 months' imprisonment with three years of supervised release. Klensch timely appealed.","United States v. Klensch, 87 F.4th 1159#11",""
"II. DISCUSSION A. Minor-Role Adjustment Klensch contends that he was entitled to a minor-role reduction because he had no knowledge of the full alien smuggling operation, he was asked to pick up ""workers"" and did not know he would be transporting illegal aliens, and he was paid only a small sum. He argues that the district court applied the wrong legal standard when it determined that he was not entitled to this reduction because he personally transported the two men.","United States v. Klensch, 87 F.4th 1159#12",""
"1. As an initial matter, the Government argues that this issue must be reviewed for plain error because Klensch did not challenge the sufficiency of the district court's reasoning below. HN1[] Federal Rule of Criminal Procedure 51(b) sets out ""a contemporaneous-objection rule"": to preserve a claim of error, a party must ""'inform[] the court—when the court ruling or order is made or sought—of the action the party wishes the court to take, or the party's objection to the court's action and the grounds for that objection.'"" Puckett v. United States, 556 U.S. 129, 135, 129 S. Ct. 1423, 173 L. Ed.","United States v. Klensch, 87 F.4th 1159#13",""
"2d 266 (2009) (quoting Fed. R. Crim. P. 51(b)). Sentencing objections ""must have a specific substantive basis"" that ""provides the district court with an opportunity to address the error in the first instance and allows this court to engage in more meaningful review."" United States v. Grissom, 525 F.3d 691, 694 (9th Cir. 2008) (citation omitted).","United States v. Klensch, 87 F.4th 1159#14",""
"Such objections may be raised at the sentencing hearing or in written objections to the PSR. See United States v. Hammond, 742 F.3d 880, 884 (9th Cir. 2014) (concluding that objections made in a ""sentencing memorandum and at sentencing"" are ""preserved""); United States v. Barnes, 993 F.2d 680, 684 (9th Cir. 1993) (concluding that ""written objections to the presentence report"" are ""sufficient to preserve the issue""). Here, Klensch argued, both in his objections to the PSR and at his sentencing hearing, that he was ""less culpable than the average"" participant and thus was entitled to the minor-role reduction.","United States v. Klensch, 87 F.4th 1159#15",""
"He specifically asserted that a comparative analysis is required and that it is not determinative ""that a defendant performs an essential or indispensable role in the criminal activity."" This is the same thrust of his argument on appeal: that the district court erred by not comparing his level of culpability to that of the other participants involved in his criminal activity and by mistakenly asserting that he did not qualify for a minor-role reduction because he ""was the one transporting the individuals."" HN2[] Because we conclude that Klensch properly preserved his challenge related to the minor-role reduction, we review de novo whether the district court applied the correct legal standard in denying a minor-role reduction, and we review its factual findings for clear error and its application of the Guidelines to the facts for abuse of discretion. United States v. Gasca-Ruiz, 852 F.3d 1167, 1170 (9th Cir. 2017) (en banc). 2.","United States v. Klensch, 87 F.4th 1159#16",""
"HN3[] Turning to the merits, § 3B1.2(b) of the Guidelines allows for a reduction in the offense level if the defendant ""was a minor participant in [the] criminal activity."" To receive this reduction, the defendant must prove that he is ""substantially less culpable than the average participant in the charged criminal activity."" United States v. Diaz, 884 F.3d 911, 914 (9th Cir. 2018) (internal quotation marks and citation omitted). Before 2015, there was confusion in the courts about whether the proper comparison was to the defendant's co-participants in the specific crime charged or to those involved in the type of crime at issue more generally. Id. at 915.","United States v. Klensch, 87 F.4th 1159#17",""
"The Sentencing Commission amended the Guideline commentary to make clear that the proper comparison is to the co-participants in the crime charged. Id. The Commission also determined that the minor-role reduction ""was being 'applied inconsistently and more sparingly than the Commission intended,'"" and it amended the commentary ""to induce district courts to grant mitigating-role adjustments more frequently."" United States v. Rodriguez, 44 F.4th 1229, 1233 (9th Cir. 2022) (citation omitted). HN4[] In its amendment, the Commission listed five factors that we have held district courts must consider ""when determining whether to grant a mitigating-role adjustment."" Id. Of particular import here, the Commission also cautioned that ""[t]he fact that a defendant performs an essential or indispensable role in the criminal activity is not determinative."" U.S.S.G. § 3B1.2 cmt. n.3(C) (emphasis added); see also Diaz, 884 F.3d at 915.","United States v. Klensch, 87 F.4th 1159#18",""
"It expressly disapproved of cases denying minor-role adjustments to defendants because they were ""'integral' or 'indispensable' to the commission of the offense."" U.S.S.G. Supp. to App. C. Amend. 794. HN5[] We have since instructed that ""a district court must proceed in three steps"" when determining ""whether a defendant is substantially less culpable than the average participant in the offense."" United States v. Dominguez-Caicedo, 40 F.4th 938, 960 (9th Cir. 2022) (emphasis added).","United States v. Klensch, 87 F.4th 1159#19",""
"First, it must identify all ""individuals for whom there is 'sufficient evidence of their existence and participation in the overall scheme.'"" Id. (citation omitted). ""Second, the court must calculate a rough average level of culpability for these individuals, taking into consideration the five factors in comment 3(C) to the Mitigating Role Guideline."" Id. And third, it ""must compare the defendant's culpability to that average."" Id. If this calculation shows that ""the defendant is substantially less culpable than that average and meets the other criteria, he should be granted a mitigating role adjustment."" Id. Here, the district court's analysis of the minor-role reduction is thin. It did not question the parties about or discuss at the sentencing hearing the factors that govern the comparative-liability analysis or the facts relevant to that analysis. Rather, after the parties' arguments, it simply pronounced: ""In this particular case, Mr.","United States v. Klensch, 87 F.4th 1159#20",""
"Klensch was the one transporting the individuals. And I don't find that there is sufficient evidence that his role was minor in this case."" HN6[] We assume district courts ""kn[o]w the law and underst[and their] obligation to consider all of the sentencing factors,"" Diaz, 884 F.3d at 916, and they do not have to ""tick off sentencing factors to show that [they] considered them,"" id. at 914 (internal quotation marks and citations omitted). But they must explain their sentencing decisions.","United States v. Klensch, 87 F.4th 1159#21",""
"United States v. Emmett, 749 F.3d 817, 820 (9th Cir. 2014). Requiring an explanation for a given sentencing decision ""permit[s] meaningful appellate review."" United States v. Carty, 520 F.3d 984, 992-93 (9th Cir. 2008) (en banc); see also Emmett, 749 F.3d at 820 (""It is a general principle of federal sentencing law that district courts have a duty to explain their sentencing decisions.""); cf. Gall v. United States, 552 U.S. 38, 50, 128 S. Ct. 586, 169 L. Ed.","United States v. Klensch, 87 F.4th 1159#22",""
"2d 445 (2007) (explaining district courts must ""adequately explain the chosen sentence""). It also ""promote[s] the perception of fair sentencing."" Emmett, 749 F.3d at 820 (internal quotation marks and citation omitted). Here, the district court's cursory explanation gives no indication that it considered the required factors or did any comparative analysis of Klensch's conduct.","United States v. Klensch, 87 F.4th 1159#23",""
"While it was not required to mechanically analyze each factor or reference them verbatim on the record, Diaz, 884 F.3d at 914, 916, providing some explanation, even in general terms, of how the considerations embodied in the factors apply in this case ""is part and parcel of considering"" them. Emmett, 749 F.3d at 820. In Diaz, which we decided before Dominguez-Caicedo, we had ""no trouble determining from the sentencing memoranda and the transcript of the sentencing hearing that the district court was well aware of the"" minor-role factors.","United States v. Klensch, 87 F.4th 1159#24",""
"Id. at 913. We therefore rejected the defendant's argument that the district court erred by failing to mention the factors in its decision. Id. at 916.","United States v. Klensch, 87 F.4th 1159#25",""
"But we were troubled by the district court's statement that the defendant's role ""of scouting and acting as a courier to smuggle a large amount of drugs across the border was not minor"" because such reasoning could ""reflect[] reliance on courier conduct as dispositive,"" and the amendment to the commentary on the minor-role adjustment ""clarified that performance of an essential role . . . is not dispositive."" Id. at 917. The same is true here. The district court's singular and cursory explanation for not granting a minor-role reduction, referencing only that Klensch drove the two men, indicates that the district court improperly relied ""on courier conduct as dispositive,"" despite the Guidelines' clarification ""that performance of an essential role . . . is not dispositive.""1 Id. The Government disputes that the district court applied the wrong legal standard.","United States v. Klensch, 87 F.4th 1159#26",""
